{
  "$schema": "../provider-manifest.v1.schema.json",
  "schemaVersion": 1,
  "key": "protolabsnetwork",
  "displayName": "Protolabs Network",
  "official": {
    "urls": [
      "https://www.hubs.com/"
    ],
    "domains": [
      "hubs.com"
    ]
  },
  "presentation": {
    "color": "#a45bd6",
    "officialRfqUrl": "https://www.hubs.com/manufacture/",
    "purchasingDomains": []
  },
  "integration": {
    "adapterKind": "declarative_portal",
    "processFamily": "multi_process",
    "implementationStage": "envelope_defined"
  },
  "capabilityEnvelope": {
    "version": 1,
    "processes": {
      "status": "supported",
      "values": [
        "cnc_machining"
      ]
    },
    "materials": {
      "status": "supported",
      "values": [
        "aluminum_6061"
      ]
    },
    "files": {
      "status": "supported",
      "values": [
        "3dm",
        "iges",
        "sat",
        "sldprt",
        "step",
        "x_t"
      ]
    },
    "quantity": {
      "status": "supported",
      "minimum": 1,
      "maximum": null
    },
    "tolerance": {
      "status": "supported",
      "minimumMm": 0.02032,
      "maximumMm": null
    },
    "geometry": {
      "status": "unknown",
      "constraints": []
    },
    "drawings": {
      "status": "supported",
      "values": [
        "pdf"
      ]
    },
    "accountModes": {
      "status": "supported",
      "values": [
        "existing_authenticated_account"
      ]
    }
  },
  "evidence": {
    "firstPartyUrls": [
      "https://www.hubs.com/guides/cnc-machining/",
      "https://www.hubs.com/help-center/faq/",
      "https://www.hubs.com/help-center/ordering-custom-parts/1-uploading-parts/uploading-cad-files/",
      "https://www.hubs.com/help-center/sign-in-with-protolabs/",
      "https://www.hubs.com/how-ordering-works/"
    ],
    "reviewedAt": "2026-09-03"
  },
  "safety": {
    "quoteOnly": true,
    "orderingProhibited": true,
    "sessionIsolationRequired": true
  }
}
