{
  "$schema": "../provider-manifest.v1.schema.json",
  "schemaVersion": 1,
  "key": "weerg",
  "displayName": "Weerg",
  "official": {
    "urls": [
      "https://www.weerg.com/"
    ],
    "domains": [
      "weerg.com"
    ]
  },
  "presentation": {
    "color": "#6a9f3f",
    "officialRfqUrl": "https://www.weerg.com/",
    "purchasingDomains": []
  },
  "integration": {
    "adapterKind": "declarative_portal",
    "processFamily": "multi_process",
    "implementationStage": "envelope_defined"
  },
  "capabilityEnvelope": {
    "version": 1,
    "processes": {
      "status": "supported",
      "values": [
        "cnc_machining"
      ]
    },
    "materials": {
      "status": "supported",
      "values": [
        "aluminum_6082"
      ]
    },
    "files": {
      "status": "supported",
      "values": [
        "step",
        "stp"
      ]
    },
    "quantity": {
      "status": "supported",
      "minimum": 1,
      "maximum": 10000
    },
    "tolerance": {
      "status": "unknown",
      "minimumMm": null,
      "maximumMm": null
    },
    "geometry": {
      "status": "supported",
      "constraints": [
        "aluminum_6082_max_500x500x300_mm"
      ]
    },
    "drawings": {
      "status": "supported",
      "values": [
        "pdf"
      ]
    },
    "accountModes": {
      "status": "supported",
      "values": [
        "existing_authenticated_account"
      ]
    }
  },
  "evidence": {
    "firstPartyUrls": [
      "https://www.weerg.com/cnc-machining-materials/aluminium",
      "https://www.weerg.com/cnc-machining-online-service",
      "https://www.weerg.com/faq/design-guidelines-for-3d-printing",
      "https://www.weerg.com/faq/how-do-i-design-the-threads-cnc",
      "https://www.weerg.com/faq/how-do-i-register",
      "https://www.weerg.com/faq/where-do-i-upload-my-3d-file"
    ],
    "reviewedAt": "2026-09-03"
  },
  "safety": {
    "quoteOnly": true,
    "orderingProhibited": true,
    "sessionIsolationRequired": true
  }
}
