{
  "$schema": "../provider-manifest.v1.schema.json",
  "schemaVersion": 1,
  "key": "geomiq",
  "displayName": "Geomiq",
  "official": {
    "urls": ["https://app.geomiq.com/", "https://geomiq.com/"],
    "domains": ["geomiq.com"]
  },
  "presentation": {
    "color": "#2f8fb8",
    "officialRfqUrl": "https://app.geomiq.com/",
    "purchasingDomains": []
  },
  "integration": {
    "adapterKind": "declarative_portal",
    "processFamily": "multi_process",
    "implementationStage": "envelope_defined"
  },
  "capabilityEnvelope": {
    "version": 1,
    "processes": {
      "status": "supported",
      "values": ["cnc_machining"]
    },
    "materials": {
      "status": "supported",
      "values": ["aluminum_6082"]
    },
    "files": {
      "status": "supported",
      "values": ["step", "stp"]
    },
    "quantity": {
      "status": "supported",
      "minimum": 1,
      "maximum": 50000
    },
    "tolerance": {
      "status": "supported",
      "minimumMm": 0.005,
      "maximumMm": 0.127
    },
    "geometry": {
      "status": "supported",
      "constraints": [
        "cnc_milling_maximum_1500x800x800_mm",
        "cnc_turning_maximum_diameter_800x1000_mm"
      ]
    },
    "drawings": {
      "status": "unknown",
      "values": []
    },
    "accountModes": {
      "status": "supported",
      "values": ["existing_authenticated_account"]
    }
  },
  "evidence": {
    "firstPartyUrls": [
      "https://app.geomiq.com/",
      "https://geomiq.com/cnc-machining-materials/",
      "https://geomiq.com/cnc-machining/",
      "https://geomiq.com/cnc-machining/cnc-milling-service/",
      "https://geomiq.com/cnc-machining/cnc-turning-service/",
      "https://geomiq.com/frequently-asked-questions/"
    ],
    "reviewedAt": "2026-09-03"
  },
  "safety": {
    "quoteOnly": true,
    "orderingProhibited": true,
    "sessionIsolationRequired": true
  }
}
