{
  "$schema": "../provider-manifest.v1.schema.json",
  "schemaVersion": 1,
  "key": "fictiv",
  "displayName": "Fictiv",
  "official": {
    "urls": [
      "https://app.fictiv.com/pages/quotes/upload"
    ],
    "domains": [
      "fictiv.com"
    ]
  },
  "presentation": {
    "color": "#7c5cff",
    "officialRfqUrl": "https://app.fictiv.com/pages/quotes/upload",
    "purchasingDomains": [
      "fictiv.com"
    ]
  },
  "integration": {
    "adapterKind": "custom_portal",
    "processFamily": "cnc_machining",
    "implementationStage": "existing_adapter"
  },
  "capabilityEnvelope": {
    "version": 1,
    "processes": {
      "status": "supported",
      "values": ["cnc_machining"]
    },
    "materials": {
      "status": "supported",
      "values": ["aluminum_6061"]
    },
    "files": {
      "status": "supported",
      "values": ["step", "stp"]
    },
    "quantity": {
      "status": "supported",
      "minimum": 1,
      "maximum": null
    },
    "tolerance": {
      "status": "unknown",
      "minimumMm": null,
      "maximumMm": null
    },
    "geometry": {
      "status": "supported",
      "constraints": ["single_solid_body"]
    },
    "drawings": {
      "status": "unknown",
      "values": []
    },
    "accountModes": {
      "status": "supported",
      "values": ["existing_authenticated_account"]
    }
  },
  "evidence": {
    "firstPartyUrls": [
      "https://www.fictiv.com/capabilities/cnc-machining-services",
      "https://www.fictiv.com/help/getting-a-quote/how-do-i-add-finishing-to-my-parts",
      "https://www.fictiv.com/help/getting-a-quote/how-to-use-the-multi-quantity-quote-feature",
      "https://www.fictiv.com/help/uploading-and-organizing-parts/what-file-formats-does-fictiv-support",
      "https://www.fictiv.com/materials/cnc-aluminum"
    ],
    "reviewedAt": "2026-09-26"
  },
  "safety": {
    "quoteOnly": true,
    "orderingProhibited": true,
    "sessionIsolationRequired": true
  }
}
