{
  "$schema": "../provider-manifest.v1.schema.json",
  "schemaVersion": 1,
  "key": "ponoko",
  "displayName": "Ponoko",
  "official": {
    "urls": [
      "https://www.ponoko.com/"
    ],
    "domains": [
      "ponoko.com"
    ]
  },
  "presentation": {
    "color": "#cf4f88",
    "officialRfqUrl": "https://www.ponoko.com/designs",
    "purchasingDomains": []
  },
  "integration": {
    "adapterKind": "declarative_portal",
    "processFamily": "sheet_fabrication",
    "implementationStage": "envelope_defined"
  },
  "capabilityEnvelope": {
    "version": 1,
    "processes": {
      "status": "supported",
      "values": [
        "laser_cutting",
        "laser_engraving"
      ]
    },
    "materials": {
      "status": "supported",
      "values": [
        "acrylic"
      ]
    },
    "files": {
      "status": "supported",
      "values": [
        "ai",
        "dxf",
        "eps",
        "step",
        "svg"
      ]
    },
    "quantity": {
      "status": "supported",
      "minimum": 1,
      "maximum": 10000
    },
    "tolerance": {
      "status": "supported",
      "minimumMm": 0.127,
      "maximumMm": 0.127
    },
    "geometry": {
      "status": "supported",
      "constraints": [
        "flat_sheet_only"
      ]
    },
    "drawings": {
      "status": "unknown",
      "values": []
    },
    "accountModes": {
      "status": "supported",
      "values": [
        "existing_authenticated_account"
      ]
    }
  },
  "evidence": {
    "firstPartyUrls": [
      "https://help.ponoko.com/en/articles/2688477-what-design-software-file-type-should-i-use",
      "https://help.ponoko.com/en/articles/4324874-can-i-use-a-stl-or-step-file",
      "https://help.ponoko.com/en/articles/5471244-how-to-design-for-metal-bending",
      "https://help.ponoko.com/en/articles/9358110-ponoko-manufacturing-standards",
      "https://www.ponoko.com/designs"
    ],
    "reviewedAt": "2026-09-03"
  },
  "safety": {
    "quoteOnly": true,
    "orderingProhibited": true,
    "sessionIsolationRequired": true
  }
}
